{
  "version": "0.0.0-dev",
  "colorSwatches": [
    "1200F6",
    "3894E1",
    "FEFF01",
    "F8D531",
    "F38E24",
    "52D048",
    "00FEBE",
    "B700F3",
    "EE301A",
    "FA5959",
    "FFFFFF",
    "D8D8D8",
    "4C4C4C",
    "782543",
    "000000"
  ],
  "weightLabels": [
    "1KG",
    "750G",
    "600G",
    "500G",
    "250G"
  ],
  "baudRates": [
    9600,
    57600,
    115200,
    230400,
    460800,
    921600
  ],
  "logLevels": [
    "0 none",
    "1 error",
    "2 warn",
    "3 info",
    "4 debug"
  ]
}
